{
  "$schema": "https://json-schema.org/draft/2020-12/schema",
  "$id": "dca-dcc-config",
  "title": "Configuration for individual DCCs in mtDCA",
  "description": "Configuration options for a specific DCC in mtDCA",
  "requires": [ "project_name", "synapse_asset_view", "data_model_url", "template_menu_config_file" ],
  "properties": {
    "project_name": {
      "description": "Name of the DCC",
      "type": "string"
    },
    "synapse_asset_view": {
      "description": "Synapse ID of the DCC's main asset view",
      "type": "string"
    },
    "data_model_url": {
      "description": "URL to the DCC's data model",
      "type": "string"
    },
    "data_model_info": {
      "description": "URL to release notes about the data model",
      "type": "string"
    },
    "template_menu_config_file": {
      "description": "URL to the template dropdown menu config",
      "type": "string"
    },
    "logo_location": {
      "description": "URL to the DCC's logo",
      "type": "string"
    },
    "logo_link": {
      "description": "Link for the DCC",
      "type": "string"
    },
    "dcc_help_link": {
      "description": "URL DCC users can seek help",
      "type": "string"
    },
    "manifest_output_format": {
      "description": "Output type for downloaded manifests. excel or google_sheet",
      "type": "string"
    },
    "manifest_use_annotations": {
      "description": "Schematic manifest get option",
      "type": "boolean"
    },
    "validate_restrict_rules": {
      "description": "Schematic model validate option",
      "type": "boolean"
    },
    "submit_use_schema_labels": {
      "description": "Schematic model submit option",
      "type": "boolean"
    },
    "submit_table_manipulation": {
      "description": "Schematic model submit option",
      "type": "string"
    },
    "submit_manifest_record_type": {
      "description": "Schematic model submit option",
      "type": "string"
    },
    "submit_hide_blanks": {
      "description": "Schematic model submit option",
      "type": "boolean"
    },
    "use_compliance_dashboard": {
      "description": "Display the compliance dashboard. Unavaible at the moment",
      "type": "boolean"
    },
    "primary_col": {
      "description": "center header color hex code",
      "type": "string"
    },
    "secondary_col": {
      "description": "right header color hex code",
      "type": "string"
    },
    "sidebar_col": {
      "description": "left header color hex code",
      "type": "string"
    }
  }
}
