{
  "project_name":"HTAN All Projects",
  "synapse_asset_view":"syn20446927",
  "data_model_url":"https://raw.githubusercontent.com/ncihtan/data-models/main/HTAN.model.jsonld",
  "template_menu_config_file":"https://raw.githubusercontent.com/Sage-Bionetworks/data_curator_config/config-refactor/dcc/HTAN/dca-template-config.json",
  "logo_location":"https://raw.githubusercontent.com/Sage-Bionetworks/data_curator_config/config-refactor/dcc/HTAN/HTAN_text_logo.png",
  "logo_link":"https://humantumoratlas.org",
  "manifest_output_format":"google_sheet",
  "manifest_use_annotations":false,
  "validate_restrict_rules":false,
  "submit_use_schema_labels":true,
  "submit_table_manipulation":"replace",
  "submit_manifest_record_type":"file_only",
  "submit_hide_blanks":false,
  "use_compliance_dashboard":false,
  "primary_col":"#605ca8",
  "secondary_col":"#5F008C",
  "sidebar_col":"#191919"
}
