[{"project_name":"AD Knowledge Portal","synapse_asset_view":"syn51324810","data_model_url":"https://raw.githubusercontent.com/adknowledgeportal/data-models/main/divco.data.model.v1.jsonld","template_menu_config_file":"ADKP/dca-template-config.json","logo_location":"ADKP/ADKnowledgePortal.png","logo_link":"https://adknowledgeportal.synapse.org","manifest_output_format":"excel","manifest_use_annotations":false,"validate_restrict_rules":false,"submit_use_schema_labels":true,"submit_table_manipulation":"replace","submit_manifest_record_type":"file_only","submit_hide_blanks":false,"use_compliance_dashboard":false,"primary_col":"#2a668d","secondary_col":"#184e71","sidebar_col":"#191919"}]
