{
  "project_name":"VEOIBD",
  "synapse_asset_view":"syn51397378",
  "data_model_url":"https://raw.githubusercontent.com/VEOIBD/data_models/main/veoibd.data.model.jsonld",
  "template_menu_config_file":"https://raw.githubusercontent.com/Sage-Bionetworks/data_curator_config/config-refactor/dcc/VEOIBD/dca-template-config.json",
  "logo_location":"https://raw.githubusercontent.com/Sage-Bionetworks/data_curator_config/config-refactor/dcc/VEOIBD/VEOIBD Logo.png",
  "logo_link":"https://veoibd.org",
  "manifest_output_format":"excel",
  "manifest_use_annotations":false,
  "validate_restrict_rules":true,
  "submit_use_schema_labels":true,
  "submit_table_manipulation":"upsert",
  "submit_manifest_record_type":"file_only",
  "submit_hide_blanks":false,
  "use_compliance_dashboard":false,
  "primary_col":"#2a668d",
  "secondary_col":"#184e72",
  "sidebar_col":"#191920"
}
