{"project_name":"DCA Test No Project Permission","synapse_asset_view":"syn52579642","data_model_url":"https://raw.githubusercontent.com/Sage-Bionetworks/data-models/main/example.model.jsonld","template_menu_config_file":"dcc/demo/dca-template-config.json","logo_location":"dcc/demo/Logo_Sage_Logomark.png","logo_link":"https://synapse.org","manifest_output_format":"google_sheet","manifest_use_annotations":false,"validate_restrict_rules":false,"submit_use_schema_labels":true,"submit_table_manipulation":"replace","submit_manifest_record_type":"table_and_file","submit_hide_blanks":false,"use_compliance_dashboard":false,"primary_col":"#2a668d","secondary_col":"#184e71","sidebar_col":"#191919"}
