{
  "project_name":"NF-OSI",
  "synapse_asset_view":"syn16858331",
  "data_model_url":"https://raw.githubusercontent.com/nf-osi/nf-metadata-dictionary/v8.0.1/NF.jsonld",
  "template_menu_config_file":"dcc/NF-OSI/dca-template-config.json",
  "manifest_output_format":"google_sheet",
  "manifest_use_annotations":true,
  "validate_restrict_rules":false,
  "submit_use_schema_labels":true,
  "submit_table_manipulation":"replace",
  "submit_manifest_record_type":"table_and_file",
  "submit_hide_blanks":true,
  "use_compliance_dashboard":false,
  "primary_col":"#2a668d",
  "secondary_col":"#184e71",
  "sidebar_col":"#191919"
}
