[{"project_name":"BTC DCC","synapse_asset_view":"syn51407795","data_model_url":"https://raw.githubusercontent.com/Sage-Bionetworks/btc-data-models/main/btc.model.jsonld","template_menu_config_file":"https://raw.githubusercontent.com/Sage-Bionetworks/data_curator_config/config-refactor/dcc/BTC/dca-template-config.json","manifest_output_format":"excel","manifest_use_annotations":false,"validate_restrict_rules":false,"submit_use_schema_labels":true,"submit_table_manipulation":"replace","submit_manifest_record_type":"table_and_file","submit_hide_blanks":false,"use_compliance_dashboard":false,"primary_col":"#2a668d","secondary_col":"#184e72","sidebar_col":"#191920"}]
