[{"project_name":"Cancer Complexity Knowledge Portal - Database","synapse_asset_view":"syn27210848","data_model_url":"https://raw.githubusercontent.com/mc2-center/data-models/main/mc2.model.jsonld","template_menu_config_file":"https://raw.githubusercontent.com/Sage-Bionetworks/data_curator_config/config-refactor/dcc/MC2/dca-template-config.json","logo_location":"https://raw.githubusercontent.com/Sage-Bionetworks/data_curator_config/config-refactor/dcc/MC2/cckp_logo.png","logo_link":"https://cancercomplexity.synapse.org","manifest_output_format":"excel","manifest_use_annotations":false,"validate_restrict_rules":false,"submit_use_schema_labels":false,"submit_table_manipulation":"upsert","submit_manifest_record_type":"table_and_file","submit_hide_blanks":false,"use_compliance_dashboard":false,"primary_col":"#407BA0","secondary_col":"#5BB0B5","sidebar_col":"#191919"}]
